{
  "$schema": "https://json-schema.org/draft/2020-12/schema",
  "$id": "https://raw.githubusercontent.com/WhisperrAI/whisperr-spec/main/schemas/push.schema.json",
  "title": "Whisperr push-token conformance cases",
  "type": "object",
  "required": ["version", "cases"],
  "additionalProperties": false,
  "properties": {
    "$schema": { "type": "string" },
    "version": { "type": "integer", "minimum": 1 },
    "description": { "type": "string" },
    "cases": {
      "description": "Flows every push-capable SDK runs. Steps use only the original string form of setPushToken, so SDKs built before token kinds keep parsing this array.",
      "type": "array",
      "minItems": 1,
      "items": { "$ref": "#/$defs/case" }
    },
    "kindCases": {
      "description": "Flows for SDKs that send the optional token kind, platform and push_env. An SDK that does not send them skips this array.",
      "type": "array",
      "items": { "$ref": "#/$defs/kindCase" }
    },
    "kindInference": {
      "description": "Server rule for a push channel that arrives without kind. Server implementations test against this table; SDKs ignore it.",
      "type": "array",
      "items": { "$ref": "#/$defs/kindInferenceCase" }
    }
  },
  "$defs": {
    "pushKind": {
      "description": "Token type. fcm = FCM registration token; apns = raw APNs device token (lowercase hex); expo = Expo push token; onesignal_sub = OneSignal subscription id.",
      "enum": ["fcm", "apns", "expo", "onesignal_sub"]
    },
    "pushPlatform": { "enum": ["ios", "android", "web", "macos", "windows", "linux"] },
    "pushEnv": {
      "description": "APNs environment of the token. A debug build gets sandbox tokens.",
      "enum": ["production", "sandbox"]
    },
    "pushChannel": {
      "description": "One push entry of identify channels[] on the wire. kind, platform, push_env, client_app_id and provider_project are optional on the wire; send them only when known. Contract v2 SDKs always send kind and platform, push_env for every apns entry, and client_app_id / provider_project when they can read them. An opt-out entry carries only channel, address and opted_in.",
      "type": "object",
      "required": ["channel", "address"],
      "additionalProperties": false,
      "properties": {
        "channel": { "const": "push" },
        "address": { "type": "string", "minLength": 1 },
        "opted_in": { "type": "boolean" },
        "verified": { "type": "boolean" },
        "kind": { "$ref": "#/$defs/pushKind" },
        "platform": { "$ref": "#/$defs/pushPlatform" },
        "push_env": { "$ref": "#/$defs/pushEnv" },
        "client_app_id": {
          "description": "Contract v2. The app that owns the token: iOS bundle id, Android package name, web origin.",
          "type": "string",
          "minLength": 1,
          "maxLength": 255
        },
        "provider_project": {
          "description": "Contract v2. The provider project the token belongs to: FCM = Firebase project id, expo = EAS project id, onesignal_sub = OneSignal app id. Not sent for apns.",
          "type": "string",
          "minLength": 1,
          "maxLength": 255
        }
      }
    },
    "case": {
      "type": "object",
      "required": ["name", "steps", "expectedBodies"],
      "additionalProperties": false,
      "properties": {
        "name": { "type": "string", "minLength": 1 },
        "steps": {
          "type": "array",
          "minItems": 1,
          "items": { "$ref": "#/$defs/step" }
        },
        "expectedBodies": {
          "type": "array",
          "items": { "type": "object" }
        }
      }
    },
    "step": {
      "type": "object",
      "minProperties": 1,
      "maxProperties": 1,
      "additionalProperties": false,
      "properties": {
        "identify": { "$ref": "#/$defs/identifyStep" },
        "setPushToken": { "type": "string" },
        "restart": { "const": true },
        "reset": { "const": true },
        "optOut": { "description": "The app calls the SDK's opt-out API.", "const": true },
        "optIn": { "description": "The app calls the SDK's opt-in API.", "const": true },
        "pushPermission": {
          "description": "The app reports this notification permission through the SDK's permission API. denied opts this device's token out and holds it; authorized or provisional opts the held token back in.",
          "enum": ["authorized", "provisional", "denied", "not_determined"]
        }
      }
    },
    "identifyStep": {
      "type": "object",
      "required": ["externalUserId"],
      "additionalProperties": false,
      "properties": {
        "externalUserId": { "type": "string", "minLength": 1 },
        "traits": { "type": "object" },
        "pushToken": { "type": "string" }
      }
    },
    "kindCase": {
      "type": "object",
      "required": ["name", "steps", "expectedBodies"],
      "additionalProperties": false,
      "properties": {
        "name": { "type": "string", "minLength": 1 },
        "steps": {
          "type": "array",
          "minItems": 1,
          "items": { "$ref": "#/$defs/kindStep" }
        },
        "expectedBodies": {
          "type": "array",
          "items": { "$ref": "#/$defs/identifyBody" }
        }
      }
    },
    "kindStep": {
      "type": "object",
      "minProperties": 1,
      "maxProperties": 1,
      "additionalProperties": false,
      "properties": {
        "identify": { "$ref": "#/$defs/identifyStep" },
        "setPushToken": {
          "oneOf": [
            { "type": "string" },
            {
              "type": "object",
              "required": ["token"],
              "additionalProperties": false,
              "properties": {
                "token": { "type": "string" },
                "kind": { "$ref": "#/$defs/pushKind" },
                "platform": { "$ref": "#/$defs/pushPlatform" },
                "pushEnv": { "$ref": "#/$defs/pushEnv" }
              }
            }
          ]
        },
        "restart": { "const": true },
        "reset": { "const": true }
      }
    },
    "identifyBody": {
      "type": "object",
      "required": ["external_user_id"],
      "additionalProperties": false,
      "properties": {
        "external_user_id": { "type": "string", "minLength": 1 },
        "traits": { "type": "object" },
        "channels": {
          "type": "array",
          "items": { "$ref": "#/$defs/pushChannel" }
        }
      }
    },
    "kindInferenceCase": {
      "type": "object",
      "required": ["name", "address", "expectedKind"],
      "additionalProperties": false,
      "properties": {
        "name": { "type": "string", "minLength": 1 },
        "address": { "type": "string", "minLength": 1 },
        "expectedKind": { "$ref": "#/$defs/pushKind" }
      }
    }
  }
}
